20200524\160000\174526\Camp Rock\ \ \ \Matthew Diamond\2008\O que Mitchie mais quer neste mundo é passar as férias de verão no prestigioso acampamento de rock, Camp Rock, para realizar seu sonho de se tornar uma cantora famosa. Ao chegar no acampamento, Mitchie descobre que entre os acampantes a competição é grande, principalmente no que diz respeito a chamar a atenção de SHANE GRAY - uma estrela pop adolescente e o professor mais popular deste verão. Shane - que busca inspiração para compôr - escuta Mitchie cantar sem conseguir ver seu rosto. Encantado por sua maravilhosa voz, procura a dona dessa linda sinfonia, enquanto ela confronta seus medos e aprende a ser uma estrela.\ \LIVRE - NÃO HÁ INADEQUAÇÕES\Estados Unidos\04
20200524\180000\194913\Camp Rock 2: The Final Jam\ \ \ \Paul Hoen\2010\O Disney Channel prepara a estréia de Camp Rock 2 The Final Jam, a sequência do filme de sucesso original do Disney Channel Camp Rock. Além disso, irão se juntar à equipe Matthew "Mdot" Finley e Chloe Bridges. O elenco também voltará a contar com a presença de Meaghan Martin, Alyson Stoner, Anna Maria Perez de Tagle, Roshon Fegan, Daniel Fathers e Maria Canals-Barrera. A estréia de Camp Rock 2 The Final Jam está programada para 2010 no Disney Channel. A sequência narra as aventuras de Mitchie, Shane, Jason, Nate e seus amigos, que voltam ao Camp Rock para passar outro maravilhoso verão com muita música e diversão. Mas, logo irão descobrir que outro acampamento de músicos mais moderno, Camp Star, se instalou na outra margem do lago e atraiu muitos instrutores e participantes do Camp Rock, colocando em risco o futuro do acampamento.\ \LIVRE - NÃO HÁ INADEQUAÇÕES\Estados Unidos\04
20200524\200000\214129\Up: Altas Aventuras\ \ \ \Pete Docter\2009\Carl Fredricksen, um vendedor de balões aposentado, rabugento e sonhador, está preparado para começar uma viagem cheia de emoções. Amarrando milhares de balões à sua casa, empreende um vôo até o mundo perdido dos seus sonhos de infância. Embora ele não saiba, Russel, um garoto explorador de 8 anos, muito ansioso e quem nunca foi mais além do pátio de sua casa, acaba no lugar e na hora errada, no telhado de Carl quando este empreende sua assombrosa viagem. Assim, a dupla mais inesperada do mundo alcança novas alturas e se encontra com fantásticos amigos como Dug, um cachorro com uma coleira falante, e Kevin, um pássaro colorido de 3 metros de altura que não pode voar. Emboscado nas entranhas de uma floresta, Carl percebe que, às vezes, as maiores aventuras da vida são aquelas que não estamos buscando.\ \LIVRE - NÃO HÁ INADEQUAÇÕES\Estados Unidos\04
20200524\220000\001910\Rogue One: Uma História Star Wars\ \ \ \ \2016\A Aliança Rebelde encara a missão de se apoderar dos planos da Estrela da Morte para poder evitar a construção da nova arma.
\ \NÃO RECOMENDADO PARA MENORES DE 12 ANOS - VIOLÊNCIA\Estados Unidos\04
20200525\003000\021054\Up: Altas Aventuras\ \ \ \Pete Docter\2009\Carl Fredricksen, um vendedor de balões aposentado, rabugento e sonhador, está preparado para começar uma viagem cheia de emoções. Amarrando milhares de balões à sua casa, empreende um vôo até o mundo perdido dos seus sonhos de infância. Embora ele não saiba, Russel, um garoto explorador de 8 anos, muito ansioso e quem nunca foi mais além do pátio de sua casa, acaba no lugar e na hora errada, no telhado de Carl quando este empreende sua assombrosa viagem. Assim, a dupla mais inesperada do mundo alcança novas alturas e se encontra com fantásticos amigos como Dug, um cachorro com uma coleira falante, e Kevin, um pássaro colorido de 3 metros de altura que não pode voar. Emboscado nas entranhas de uma floresta, Carl percebe que, às vezes, as maiores aventuras da vida são aquelas que não estamos buscando.\ \LIVRE - NÃO HÁ INADEQUAÇÕES\Estados Unidos\04
20200525\023000\042054\Enfrentando a Barra\ \ \ \Glen Clay\2016\Kelly é uma adolescente que tem que se adaptar a uma nova vida em um país distante depois dos seus pais se separarem. Ela escolhe morar com a mãe e está feliz com a chance de mudar de ritmo e de vida, mas sente saudade de suas amigas da sua cidade natal.
\ \LIVRE - NÃO HÁ INADEQUAÇÕES\Estados Unidos\04
20200525\043000\045616\Gravity Falls: Um Verão de Mistérios\Cada Um no Seu Quadrado\1\17\Alex Hirsch \2012\Gravity Falls: Um Verão de Mistérios é uma série de animação cômica sobre os gêmeos Dipper e Mabel, dois garotos urbanos que vão passar as férias de verão com seu velho e rabugento tio-avô, Stan (mais conhecido como “Grunkle Stan”), que mora no povoado de Gravity Falls, no Oregon.\Quando Dipper descobre um quarto secreto na Cabana do Mistério, se sente feliz por ter o seu próprio espaço, mas há um problema: Mabel também quer quarto. Os dois competem pelo quarto, numa disputa que se torna ainda mais complicada quando descobrem que o tapete do lugar possui propriedades elétricas que provoca a troca de corpos.\LIVRE - NÃO HÁ INADEQUAÇÕES\Estados Unidos\04
20200525\050000\052705\Star vs. as Forças do Mal\Demonicismo / Largando no Segundo Ano\3\42\ \2017\“Star vs. As Forças do Mal” acompanha Star, uma determinada princesa adolescente de outra dimensão. Após receber uma poderosa varinha mágica no seu aniversário de 14 anos, Star é enviada à Terra por seus pais para viver com a família Dias e seu responsável filho, Marco. Ela traz o seu estilo único e interdimensional ao novo lar. Ao lado de Marco, Star navega pelo colégio e embarca em aventuras por várias dimensões do multiverso, protegendo sua varinha das garras do seu arqui-inimigo, Ludo, e de suas monstruosas forças do mal.\ \LIVRE - NÃO HÁ INADEQUAÇÕES\Estados Unidos\04
20200525\053000\055703\Hotel Transylvania – A Série\Episódio 18\1\18\Genndy Tartakovsky\2017\Bem-vindo ao Hotel Transilvânia, o luxuoso resort cinco estacas do Drácula, onde monstros e suas famílias podem relaxar e onde humanos não entram. Um fim de semana especial, Drácula (Adam Sandler) convidou seus melhores amigos, Frankenstein e a esposa, a Múmia, o Homem Invisível, a família do Lobisomem e vários outros para comemorar o aniversário de 118 anos de sua querida filha Mavis (Selena Gomez). Receber todos esses monstros famosos é fácil para o Drácula, mas a festa realmente começa quando um cara comum chega ao hotel, e aí tudo pode mudar!\ \LIVRE - NÃO HÁ INADEQUAÇÕES\Estados Unidos\04
20200525\060000\062233\Ducktales – Os Caçadores de Aventuras\ \2\33\ \2017\Baseado na clássica e amada série da Disney, "Ducktales" revive as aventuras do Pato Donald e seus três sobrinhos com o Tio Patinhas e vários outros personagens adoráveis.\ \LIVRE - NÃO HÁ INADEQUAÇÕES\Estados Unidos\04
20200525\060500\061707\Rua Dálmatas 101\ \1\26\ \2018\ \ \LIVRE - NÃO HÁ INADEQUAÇÕES\Reino Unido\04
20200525\061000\062150\Vá embora, Unicórnio!\ \1\22\ \2018\Vá embora, Unicórnio! As divertidas aventuras de uma esperta, forte, decidida e muito certinha menina chamada Alice e seu bagunceiro e apaixonante melhor amigo, Unicórnio.\ \LIVRE - NÃO HÁ INADEQUAÇÕES\Estados Unidos\04
20200525\062000\064241\Enrolados outra vez - A Série\ \1\14\ \2017\ \ \LIVRE - NÃO HÁ INADEQUAÇÕES\Estados Unidos\04
20200525\063000\065203\Os Vizinhos Green\A Carteira de Motorista da Vovó / Preso ao Urso\1\4\ \2018\Os Vizinhos Green é uma série animada de comédia e aventura que segue as aventuras pouco convencionais de Cricket Green, um garoto travesso e otimista de 10 anos que se muda à cidade grande com sua família. \ \LIVRE - NÃO HÁ INADEQUAÇÕES\Estados Unidos\04
20200525\060000\062841\Gravity Falls: Um Verão de Mistérios\Estranhagedon 1: Fuga da Realidade\2\38\Alex Hirsch \2013\Gravity Falls: Um Verão de Mistérios é uma série de animação cômica sobre os gêmeos Dipper e Mabel, dois garotos urbanos que vão passar as férias de verão com seu velho e rabugento tio-avô, Stan (mais conhecido como “Grunkle Stan”), que mora no povoado de Gravity Falls, no Oregon.\ \LIVRE - NÃO HÁ INADEQUAÇÕES\Estados Unidos\04
20200525\063000\065810\Ducktales – Os Caçadores de Aventuras\ \2\47\ \2017\Baseado na clássica e amada série da Disney, "Ducktales" revive as aventuras do Pato Donald e seus três sobrinhos com o Tio Patinhas e vários outros personagens adoráveis.\ \LIVRE - NÃO HÁ INADEQUAÇÕES\Estados Unidos\04
20200525\070000\072841\Princesinha Sofia\A Fábula do Cavaleiro Nobre\3\79\JAMIE MITCHELL \2013\Princesinha Sofia é a primeira série centrada em uma princesa como uma garotinha. As histórias são projetadas para transmitir mensagens positivas e lições de vida que são aplicáveis a crianças em idade pré-escolar. As histórias da "Princesinha Sofia" se passam em um mundo de conto de fadas da jovem Sofia, que começa sua vida como uma garota normal. Mas quando sua mãe se casa com o rei, ela é levada para um glamouroso, mas às vezes confuso, mundo do castelo da realeza e seus novos meio-irmãos, Amber e James. "Princesinha Sofia" vai incluir participações da Fauna, Flora e Primavera (fadas vistas no clássico da Disney "A Bela Adormecida") como as diretoras da Royal Prep, a academia que a Sofia frequenta junto com outros príncipes e princesas. Aparições especiais serão feitas por personagens clássicos, como Cinderela e outras Princesas Disney.\No terceiro episódio de quarto partes da história de "A Biblioteca Secreta" Sofia aprende um conto de dois cavaleiros concorrentes, a aprende a ver além das aparências duranre a tarefa de escolher entre ambos quem salvaria ao reino dos dragões usando ao Escudo do fogo gelado mágico.\LIVRE - NÃO HÁ INADEQUAÇÕES\Estados Unidos\04
20200525\073000\074438\Doutora Brinquedos e Seu Hospital\ \4\231\Norton  Virgien\2016\Doutora Brinquedos conta a história de uma garotinha de seis anos que tem a habilidade de falar com bichinhos de pelúcia e outros bonecos, dos quais cuida em sua clínica para brinquedos. Quando a pequena Doutora coloca o estetoscópio, acontece algo mágico: seus bonecos e bichinhos ganham vida e ela pode se comunicar com todos, até com os de seus amigos e de outras crianças da vizinhança. Os assistentes da Doutora na clínica especial são seus adoráveis bichinhos de pelúcia: Felpudo, um dragão muito orgulhoso; Lambie, sua meiga melhor amiga; Hallie, uma alegre e carinhosa enfermeira hipopótamo; Barulhento, um apavorado e escandaloso peixinho; e Gelinho, um boneco de neve que passa boa parte do tempo se consultando na clínica.\ \LIVRE - NÃO HÁ INADEQUAÇÕES\Estados Unidos\04
20200525\074500\075941\Vampirina\ \2\51\ \2018\Vampirina conta a história de uma jovem vampire que enfrenta as alegrias e as provações de ser a nova garota na cidade quando sua família se muda da Transilvânia para a Pensilvânia.\ \LIVRE - NÃO HÁ INADEQUAÇÕES\Estados Unidos\04
20200525\080000\081352\TOTS — Serviço de Entrega de Filhotes\T.O.T.S. Tiny Ones Transport Service\1\30\Gilligan Chris\2019\O pinguim-pip e o flamingo Freddy são duas entregas de animais em T.O.T.S. Serviço de Transporte para Pequenos Juntos Ajudam a cuidar dos pequenos, enquanto viajam pelo mundo para encontrar um lar\ \LIVRE - NÃO HÁ INADEQUAÇÕES\Estados Unidos\04
20200525\081500\082936\Mickey Mouse — Mix de Aventuras\Mixed-Up for a day!\3\115\Likomanov Broni\2019\Cachorro quente! O animado “Aventuras Mistas do Mickey Mouse” leva a estrela número 1 da Disney, Mickey Mouse, e seus amigos, Minnie, Pateta, Donald, Margarida, Plutão, Chip e Dale, em aventuras loucas por toda Hot Dog Hills em locais divertidos, incluindo Mickey's nova casa cheia de gadgets, o Mixed-Up Motor Lab da Mickey's Garage e o escritório Minnie, Daisy e Cuckoo Loca, Happy Helpers. Projetado para transmitir lições sobre amizade, trabalho em equipe e comunidade, cada episódio apresenta um intervalo de dança em que Mickey e sua turma convidam os espectadores a dançar junto com uma versão atualizada do cachorro-quente favorito dos fãs "Hot Dog!" música.\ \LIVRE - NÃO HÁ INADEQUAÇÕES\Estados Unidos\04
20200525\083000\085948\Doutora Brinquedos\ \5\134\ \2018\ \ \LIVRE - NÃO HÁ INADEQUAÇÕES\Estados Unidos\04
20200525\090000\091252\Nivis – Amigos de Outro Mundo\O Celular\2\31\ \2019\ \Marisol visita a casa do Amadeo e Bllink e Nox fazem uma travessura com o seu celular, o que pode ter graves consequências.\LIVRE - NÃO HÁ INADEQUAÇÕES\Argentina\04
20200525\091500\092911\Vá embora, Unicórnio!\ \1\27\ \2018\Vá embora, Unicórnio! As divertidas aventuras de uma esperta, forte, decidida e muito certinha menina chamada Alice e seu bagunceiro e apaixonante melhor amigo, Unicórnio.\ \LIVRE - NÃO HÁ INADEQUAÇÕES\Estados Unidos\04
20200525\093000\112056\Hannah Montana: O Filme\ \ \ \Peter Chelsom\2009\Reviva e guarde para sempre as risadas, a diversão para toda a família e as incríveis músicas de Hannah, quando ela volta às suas raízes, divide a tela com fabulosas estrelas convidadas (Taylor Swift, Rascal Flatts e Vanessa Williams) e se vê diante da decisão mais importante de sua vida.\ \LIVRE - NÃO HÁ INADEQUAÇÕES\Estados Unidos\04
20200525\113000\114354\Rua Dálmatas 101\ \1\12\ \2018\ \ \LIVRE - NÃO HÁ INADEQUAÇÕES\Reino Unido\04
20200525\114500\115824\Zip Zip\ \2\90\ \2016\A raposa Washington, o javali Sam, e Eugenie, a irmãzinha de Sam, estão cansados de sua vida monótona na natureza selvagem. Eles anseiam pela vida confortável dos lares elegantes da cidade e decidem se fazer passar por animais domésticos comuns. Até agora, ninguém percebeu nada, mas com certeza os instintos desses animaizinhos selvagens vão acabar se revelando nos momentos mais desafiadores, levando a muitas situações engraçadas e de suspense!\ \LIVRE - NÃO HÁ INADEQUAÇÕES\França\04
20200525\120000\121321\Cupcake & Dino - Serviços Gerais\ \1\31\ \2019\Cupcake e Dino são dois irmãos que encaram um empreendimento de serviços gerais. Eles aceitam qualquer trabalho, de cortar grama e cuidar de casas até deter um monstro de outra dimensão antes que devore a cidade inteira.\ \LIVRE - NÃO HÁ INADEQUAÇÕES\Brasil\01
20200525\121500\122821\Cupcake & Dino - Serviços Gerais\ \1\32\ \2019\Cupcake e Dino são dois irmãos que encaram um empreendimento de serviços gerais. Eles aceitam qualquer trabalho, de cortar grama e cuidar de casas até deter um monstro de outra dimensão antes que devore a cidade inteira.\ \LIVRE - NÃO HÁ INADEQUAÇÕES\Brasil\01
20200525\123000\125815\GLITTER MODEL - UMA AVENTURA CHEIA DE ESTILO\ \3\36\ \2019\ \ \LIVRE - NÃO HÁ INADEQUAÇÕES\Brasil\01
20200525\130000\132826\Jessie\"Guerra das Estrelas"\1\14\Pamela Eells\2011\Jessie es una chica pueblerina con grandes sueños que se embarca en la aventura más grande de su vida cuando decide dejar atrás sus noches estrelladas de la zona rural de Texas, y cambiarlas por las luces de la Gran Manzana. Entusiasmada ante la posibilidad de independizarse y resuelta a no dejarse intimidar por Nueva York, acepta un trabajo como niñera de una próspera pareja, Morgan y Pandora, y sus cuatro hijos: Emma, Ravi, Luke y Zuri.\Jessie ajuda a Jordan Taylor, a adolescente estrela de cinema que está hospedada na casa dos Ross. Como Emma e Jessie competem para chamar a atenção de Jordan, Zuri, Ravi e Luke revisam sua maleta e encontram algumas surpresas. \LIVRE - NÃO HÁ INADEQUAÇÕES\Estados Unidos\04
20200525\133000\141521\Bia\ \2\80\Jorge Bechara\2019\ \Na final de dancing games, Marcos coloca seu boicote em marcha, mas tudo dá uma reviravolta inesperada. Manuel descobre um segredo que mudará sua vida, e Binuel fica exposto. 
\LIVRE - NÃO HÁ INADEQUAÇÕES\Argentina\04
20200525\141500\142839\Hotel Transylvania: The Series\116 Candles\1\23\ \2017\Bem-vindo ao Hotel Transilvânia, o luxuoso resort cinco estacas do Drácula, onde monstros e suas famílias podem relaxar e onde humanos não entram. Um fim de semana especial, Drácula (Adam Sandler) convidou seus melhores amigos, Frankenstein e a esposa, a Múmia, o Homem Invisível, a família do Lobisomem e vários outros para comemorar o aniversário de 118 anos de sua querida filha Mavis (Selena Gomez). Receber todos esses monstros famosos é fácil para o Drácula, mas a festa realmente começa quando um cara comum chega ao hotel, e aí tudo pode mudar!\ \LIVRE - NÃO HÁ INADEQUAÇÕES\Estados Unidos\04
20200525\143000\145958\Coop e Cami\Prefere Ter Uma Barba?\1\13\ \2018\Coop e Cami são dois irmãos de meia-idade que fazem crowdsource na tomada de decisões on-line. Eles apresentam duas opções para sua base de fãs, que eles chamam de Wratherheads, que escolhe quais coop, Coop, Cami, Fred ou Ollie devem fazer.\ \LIVRE - NÃO HÁ INADEQUAÇÕES\Estados Unidos\04
20200525\150000\152748\Tal Sydney, Tal Max\ \1\21\ \2019\Sydney to the Max é uma comédia que gira em torno de Sydney Reynolds, uma estudante muito sociável e gentil. Juntamente com o pai solteiro e protetor chamado Max, eles devem enfrentar os desafios que surgem quando crescerem. A ficção se passa no presente, mas com lembranças retrospectivas dos anos 90. Graças a isso e à ajuda da avó Judy, pai e filha percebem que eles têm muito mais em comum do que pensavam.\ \LIVRE - NÃO HÁ INADEQUAÇÕES\Estados Unidos\04
20200525\153000\155352\Andi Mack\A Sociedade Secreta\3\48\ \2019\Andi Mack é uma história sobre uma garota que pode se relacionar e está tentando determinar onde se encaixa e de quantas formas incríveis a vida pode ser vivida. Na véspera de seu aniversário de 13 anos, Andi descobre que sua irmã mais velha, Bex, na verdade é sua mãe. Esta revelação coloca a Andi em um caminho desconhecido que demonstra que o inesperado é o que faz com que a vida seja maravilhosa. \Andi Mack é uma história sobre uma garota que pode se relacionar e está tentando determinar onde se encaixa e de quantas formas incríveis a vida pode ser vivida. Na véspera de seu aniversário de 13 anos, Andi descobre que sua irmã mais velha, Bex, na verdade é sua mãe. Esta revelação coloca a Andi em um caminho desconhecido que demonstra que o inesperado é o que faz com que a vida seja maravilhosa. \LIVRE - NÃO HÁ INADEQUAÇÕES\Estados Unidos\04
20200525\160000\162944\Bunk'd\ \4\70\ \2019\ \ \LIVRE - NÃO HÁ INADEQUAÇÕES\Estados Unidos\04
20200525\163000\165920\A Casa da Raven\ \2\14\ \2018\Raven e Chelsea vivem com seus filhos na mesma casa. Raven vê o futuro e seu filho descobre que tem a mesma habilidade. Juntos resolvem qualquer situação como uma grande família feliz.\ \LIVRE - NÃO HÁ INADEQUAÇÕES\Estados Unidos\04
20200525\170000\172659\The Owl House – A Casa Coruja\The Owl House\1\4\ \2019\ \ \LIVRE - VIOLÊNCIA FANTASIOSA\Estados Unidos\04
20200525\173000\175740\Os Vizinhos Green\Cricket’s Kapowie / Car Trouble\2\31\ \2019\Os Vizinhos Green é uma série animada de comédia e aventura que segue as aventuras pouco convencionais de Cricket Green, um garoto travesso e otimista de 10 anos que se muda à cidade grande com sua família. \ \LIVRE - NÃO HÁ INADEQUAÇÕES\Estados Unidos\04
20200525\180000\181349\Amphibia\A Última Barraca dos Plantar\1\18\ \2019\Amphibia é uma comédia animada que narra as aventuras de Anne Boonchuy, uma garota de 13 anos, que se transporta, de forma mágica, ao mundo fantástico de Amphibia, um pântano rural cheio de rãs. Com a ajuda de uma jovem rã chamada Sprig, Anne se transformará em uma heroína e descobrirá a primeira amizade verdadeira de sua vida. \ \LIVRE - NÃO HÁ INADEQUAÇÕES\Estados Unidos\04
20200525\181500\182840\Vá embora, Unicórnio!\ \1\22\ \2018\Vá embora, Unicórnio! As divertidas aventuras de uma esperta, forte, decidida e muito certinha menina chamada Alice e seu bagunceiro e apaixonante melhor amigo, Unicórnio.\ \LIVRE - NÃO HÁ INADEQUAÇÕES\Estados Unidos\04
20200525\183000\190031\Gabby Duran – Babá de Aliens\ \1\7\ \2019\ \ \LIVRE - NÃO HÁ INADEQUAÇÕES\Estados Unidos\04
20200525\190000\194157\Bia\ \2\81\Jorge Bechara\2019\ \Bia se enfrenta a seus pais depois que seu namoro clandestino com Manuel foi descoberto. Marcos se enfrenta a graves consequências depois de ser exposto nas redes como hacker contra o Fundom. 
\LIVRE - NÃO HÁ INADEQUAÇÕES\Argentina\04
20200525\194500\195824\Os Vizinhos Green\Dia do Desfile\1\19\ \2019\Os Vizinhos Green é uma série animada de comédia e aventura que segue as aventuras pouco convencionais de Cricket Green, um garoto travesso e otimista de 10 anos que se muda à cidade grande com sua família. \ \LIVRE - NÃO HÁ INADEQUAÇÕES\Estados Unidos\04
20200525\200000\203157\Me Encontra em Paris\High-stakes Hip-Hop\1\16\ \2018\Lena Grisky é uma princesa russa de 1905 que estuda na escola de balé da Ópera de Paris. Acidentalmente, ela viaja no tempo e tem que se adaptar à vida do presente, tentando guardar seu segredo para lutar contra os Coletores do Tempo, que têm a intenção de capturá-la.
\ \LIVRE - NÃO HÁ INADEQUAÇÕES\ \04
20200525\203000\220701\Zombies 2\ \ \ \Paul Hoen\2020\A saga continua em Seabrook High, onde, depois de um semestre inovador, chega um grupo de forasteiros, homens-lobo misteriosos, que ameaçam a paz, o que causa a ruptura do romance inicial entre Zed e Addison. \ \LIVRE - NÃO HÁ INADEQUAÇÕES\Estados Unidos\04
20200525\223000\231153\Bia\ \2\81\Jorge Bechara\2019\ \Bia se enfrenta a seus pais depois que seu namoro clandestino com Manuel foi descoberto. Marcos se enfrenta a graves consequências depois de ser exposto nas redes como hacker contra o Fundom. 
\LIVRE - NÃO HÁ INADEQUAÇÕES\Argentina\04
20200525\231500\232819\Star vs. as Forças do Mal\Ser Mistério\2\46\ \2016\“Star vs. As Forças do Mal” acompanha Star, uma determinada princesa adolescente de outra dimensão. Após receber uma poderosa varinha mágica no seu aniversário de 14 anos, Star é enviada à Terra por seus pais para viver com a família Dias e seu responsável filho, Marco. Ela traz o seu estilo único e interdimensional ao novo lar. Ao lado de Marco, Star navega pelo colégio e embarca em aventuras por várias dimensões do multiverso, protegendo sua varinha das garras do seu arqui-inimigo, Ludo, e de suas monstruosas forças do mal.\ \LIVRE - NÃO HÁ INADEQUAÇÕES\Estados Unidos\04
20200525\233000\000147\Me Encontra em Paris\High-stakes Hip-Hop\1\16\ \2018\Lena Grisky é uma princesa russa de 1905 que estuda na escola de balé da Ópera de Paris. Acidentalmente, ela viaja no tempo e tem que se adaptar à vida do presente, tentando guardar seu segredo para lutar contra os Coletores do Tempo, que têm a intenção de capturá-la.
\ \LIVRE - NÃO HÁ INADEQUAÇÕES\ \04
20200526\000000\002818\Os Vizinhos Green\ \2\36\ \2019\Os Vizinhos Green é uma série animada de comédia e aventura que segue as aventuras pouco convencionais de Cricket Green, um garoto travesso e otimista de 10 anos que se muda à cidade grande com sua família. \ \LIVRE - NÃO HÁ INADEQUAÇÕES\Estados Unidos\04
20200526\003000\022046\Hannah Montana: O Filme\ \ \ \Peter Chelsom\2009\Reviva e guarde para sempre as risadas, a diversão para toda a família e as incríveis músicas de Hannah, quando ela volta às suas raízes, divide a tela com fabulosas estrelas convidadas (Taylor Swift, Rascal Flatts e Vanessa Williams) e se vê diante da decisão mais importante de sua vida.\ \LIVRE - NÃO HÁ INADEQUAÇÕES\Estados Unidos\04
20200526\023000\024151\Star vs. as Forças do Mal\Dia da Miunindependência\01\21\Daron Nefcy\2015\“Star vs. As Forças do Mal” acompanha Star, uma determinada princesa adolescente de outra dimensão. Após receber uma poderosa varinha mágica no seu aniversário de 14 anos, Star é enviada à Terra por seus pais para viver com a família Dias e seu responsável filho, Marco. Ela traz o seu estilo único e interdimensional ao novo lar. Ao lado de Marco, Star navega pelo colégio e embarca em aventuras por várias dimensões do multiverso, protegendo sua varinha das garras do seu arqui-inimigo, Ludo, e de suas monstruosas forças do mal.\Star encabeça a recriação de uma batalha como parte da celebração do Dia da Independência de Mewni com seus amigos na Terra. \LIVRE - NÃO HÁ INADEQUAÇÕES\Estados Unidos\04
20200526\024500\025611\Mickey Mouse\Mickey Mouse\3\17\ \2016\Mickey viaja a diferentes lugares para viver momentos fofos e heroicos com seus divertidos amigos: Minnie, Pato Donald, Margarida, Pateta e Pluto.\ \LIVRE - NÃO HÁ INADEQUAÇÕES\Estados Unidos\04
20200526\030000\035246\Sou Luna\Episódio 126\2\126\ \2017\ \ \LIVRE - NÃO HÁ INADEQUAÇÕES\Argentina\04
20200526\040000\042713\Hotel Transylvania – A Série\Episódio 22\1\22\Genndy Tartakovsky\2017\Bem-vindo ao Hotel Transilvânia, o luxuoso resort cinco estacas do Drácula, onde monstros e suas famílias podem relaxar e onde humanos não entram. Um fim de semana especial, Drácula (Adam Sandler) convidou seus melhores amigos, Frankenstein e a esposa, a Múmia, o Homem Invisível, a família do Lobisomem e vários outros para comemorar o aniversário de 118 anos de sua querida filha Mavis (Selena Gomez). Receber todos esses monstros famosos é fácil para o Drácula, mas a festa realmente começa quando um cara comum chega ao hotel, e aí tudo pode mudar!\ \LIVRE - NÃO HÁ INADEQUAÇÕES\Estados Unidos\04
