20200414\195118\200305\Zip Zip\ \2\57\ \2016\A raposa Washington, o javali Sam, e Eugenie, a irmãzinha de Sam, estão cansados de sua vida monótona na natureza selvagem. Eles anseiam pela vida confortável dos lares elegantes da cidade e decidem se fazer passar por animais domésticos comuns. Até agora, ninguém percebeu nada, mas com certeza os instintos desses animaizinhos selvagens vão acabar se revelando nos momentos mais desafiadores, levando a muitas situações engraçadas e de suspense!\ \LIVRE - NÃO HÁ INADEQUAÇÕES\França\04
20200414\200305\203215\Me Encontra em Paris\Between the Bricks\1\15\ \2018\Lena Grisky é uma princesa russa de 1905 que estuda na escola de balé da Ópera de Paris. Acidentalmente, ela viaja no tempo e tem que se adaptar à vida do presente, tentando guardar seu segredo para lutar contra os Coletores do Tempo, que têm a intenção de capturá-la.
\ \LIVRE - NÃO HÁ INADEQUAÇÕES\ \04
20200414\203216\215355\A Bela Adormecida\ \ \ \Clyde Geronimi\1959\A história da princesa Aurora, que cai em sono eterno e precisa ser despertada pelo beijo de um príncipe.Era uma vez uma bela princesa chamada Aurora, cujo destino estava marcado por uma terrível maldição: furar o dedo em uma roca e cair em sono eterno. Mas as três engraçadas Fadas Madrinhas de Aurora, descobrem uma maneira de desfazer o feitiço: um beijo do valente Príncipe Felipe poderia despertar a Princesa adormecida. Sem ajuda, Felipe tem que enfrentar a fúria terrível da mais maligna feiticeira... Malévola!\ \LIVRE - NÃO HÁ INADEQUAÇÕES\Estados Unidos\04
20200414\215356\223347\Bia\ \2\82\Jorge Bechara\2019\ \Bia discute com seus pais, e é bem recebida na república Kunst. Manuel e Bia encontram um novo “companheiro de aventuras” no parque, e um erro de Manuel faz com que Bia se aproxime da verdade…
\LIVRE - NÃO HÁ INADEQUAÇÕES\Argentina\04
20200414\223347\224513\Star vs. as Forças do Mal\Biscoitinhos da Sorte\01\16\Daron Nefcy\2015\“Star vs. As Forças do Mal” acompanha Star, uma determinada princesa adolescente de outra dimensão. Após receber uma poderosa varinha mágica no seu aniversário de 14 anos, Star é enviada à Terra por seus pais para viver com a família Dias e seu responsável filho, Marco. Ela traz o seu estilo único e interdimensional ao novo lar. Ao lado de Marco, Star navega pelo colégio e embarca em aventuras por várias dimensões do multiverso, protegendo sua varinha das garras do seu arqui-inimigo, Ludo, e de suas monstruosas forças do mal.\Marco convence a Star de que os biscoitos da fortuna contém profecias mágicas, o que perigosamente a leva a acreditar em um falso biscoito que dá ao novo experto de Ludo em eficiência maléfica, Toffee. \LIVRE - NÃO HÁ INADEQUAÇÕES\Estados Unidos\04
20200414\224514\230743\Gravity Falls: Um Verão de Mistérios\O Jogo do Blendin\2\28\Alex Hirsch \2013\Gravity Falls: Um Verão de Mistérios é uma série de animação cômica sobre os gêmeos Dipper e Mabel, dois garotos urbanos que vão passar as férias de verão com seu velho e rabugento tio-avô, Stan (mais conhecido como “Grunkle Stan”), que mora no povoado de Gravity Falls, no Oregon.\Blendin Blandin está de volta para enfrentar Dipper e Mabel em uma batalha futurista que poderia prendê-los para sempre na prisão do tempo.\LIVRE - NÃO HÁ INADEQUAÇÕES\Estados Unidos\04
20200414\230744\233308\Os Vizinhos Green\Bill Funil / Crise no Bichobol\1\9\ \2018\Os Vizinhos Green é uma série animada de comédia e aventura que segue as aventuras pouco convencionais de Cricket Green, um garoto travesso e otimista de 10 anos que se muda à cidade grande com sua família. \ \LIVRE - NÃO HÁ INADEQUAÇÕES\Estados Unidos\04
20200414\233308\012705\Descendentes 2\ \ \ \Kenny Ortega\2017\A história dos filhos e filhas adolescentes dos vilões mais abomináveis da Disney continua nesta criativa sequência com uma proposta musical que fala da amizade, do empoderamento feminino, do trabalho em equipe e da autodescoberta de cada indivíduo.\ \LIVRE - VIOLÊNCIA\Estados Unidos\04
20200415\012705\013914\Star vs. as Forças do Mal\Eclipsa Total da Lua\3\100\ \2017\“Star vs. As Forças do Mal” acompanha Star, uma determinada princesa adolescente de outra dimensão. Após receber uma poderosa varinha mágica no seu aniversário de 14 anos, Star é enviada à Terra por seus pais para viver com a família Dias e seu responsável filho, Marco. Ela traz o seu estilo único e interdimensional ao novo lar. Ao lado de Marco, Star navega pelo colégio e embarca em aventuras por várias dimensões do multiverso, protegendo sua varinha das garras do seu arqui-inimigo, Ludo, e de suas monstruosas forças do mal.\ \LIVRE - NÃO HÁ INADEQUAÇÕES\Estados Unidos\04
20200415\013915\015027\Mickey Mouse\Mickey Mouse\2\11\ \2015\Mickey viaja a diferentes lugares para viver momentos fofos e heroicos com seus divertidos amigos: Minnie, Pato Donald, Margarida, Pateta e Pluto.\ \LIVRE - NÃO HÁ INADEQUAÇÕES\Estados Unidos\04
20200415\015027\023757\Sou Luna\Episódio 97\2\97\ \2017\ \ \LIVRE - NÃO HÁ INADEQUAÇÕES\Argentina\04
20200415\023757\030038\Hotel Transylvania – A Série\Episódio 22\1\22\Genndy Tartakovsky\2017\Bem-vindo ao Hotel Transilvânia, o luxuoso resort cinco estacas do Drácula, onde monstros e suas famílias podem relaxar e onde humanos não entram. Um fim de semana especial, Drácula (Adam Sandler) convidou seus melhores amigos, Frankenstein e a esposa, a Múmia, o Homem Invisível, a família do Lobisomem e vários outros para comemorar o aniversário de 118 anos de sua querida filha Mavis (Selena Gomez). Receber todos esses monstros famosos é fácil para o Drácula, mas a festa realmente começa quando um cara comum chega ao hotel, e aí tudo pode mudar!\ \LIVRE - NÃO HÁ INADEQUAÇÕES\Estados Unidos\04
20200415\030039\032305\A Irmã do Meio\ \2\34\ \2016\Em A Irmã do Meio, a inventora, pesquisadora, mediadora e muito persuasiva Harley Díaz abre caminho através da loucura que é fazer parte de uma feliz família integrada por nove membros, a partir da vantajosa posição de ‘filha do meio’ pré-adolescente. A nova série de comédia, realizada com câmera única, tem como foco o público de 6 a 14 anos e suas famílias. As comoventes e divertidas histórias desta grande família mostram Harley idealizando formas criativas para enfrentar e se destacar em um lar localizado no subúrbio de Massachusetts. Sua criatividade frequentemente persuade os seus familiares, mesmo se tratando de personalidades muito diferentes convivendo sob o mesmo teto.\ \LIVRE - NÃO HÁ INADEQUAÇÕES\Estados Unidos\04
20200415\032306\034517\Jessie\Tchau, Tchau, Bertie\4\88\Pamela Eells\2014\Jessie es una chica pueblerina con grandes sueños que se embarca en la aventura más grande de su vida cuando decide dejar atrás sus noches estrelladas de la zona rural de Texas, y cambiarlas por las luces de la Gran Manzana. Entusiasmada ante la posibilidad de independizarse y resuelta a no dejarse intimidar por Nueva York, acepta un trabajo como niñera de una próspera pareja, Morgan y Pandora, y sus cuatro hijos: Emma, Ravi, Luke y Zuri.\Bertram está cansado dos meninos Ross, assim que decide se demitir e vai trabalhar com a senhora Chesterfield. Enquanto isso, a família Ross contrata a um novo mordomo, Roger, quem leva seu trabalho muito a sério. \LIVRE - NÃO HÁ INADEQUAÇÕES\Estados Unidos\04
20200415\034517\040742\Star vs. as Forças do Mal\Encare a Música\2\34\ \2016\“Star vs. As Forças do Mal” acompanha Star, uma determinada princesa adolescente de outra dimensão. Após receber uma poderosa varinha mágica no seu aniversário de 14 anos, Star é enviada à Terra por seus pais para viver com a família Dias e seu responsável filho, Marco. Ela traz o seu estilo único e interdimensional ao novo lar. Ao lado de Marco, Star navega pelo colégio e embarca em aventuras por várias dimensões do multiverso, protegendo sua varinha das garras do seu arqui-inimigo, Ludo, e de suas monstruosas forças do mal.\ \LIVRE - NÃO HÁ INADEQUAÇÕES\Estados Unidos\04
20200415\040742\042923\Gravity Falls: Um Verão de Mistérios\O Fim Profundo\1\13\Alex Hirsch \2012\Gravity Falls: Um Verão de Mistérios é uma série de animação cômica sobre os gêmeos Dipper e Mabel, dois garotos urbanos que vão passar as férias de verão com seu velho e rabugento tio-avô, Stan (mais conhecido como “Grunkle Stan”), que mora no povoado de Gravity Falls, no Oregon.\Quando Mabel faz amizade com um belo tritão que está preso no fundo da piscina pública, ela decide levá-lo de volta para sua família no oceano – mesmo que isso signifique que o seu romance relâmpago chegará ao fim. Enquanto isso, Dipper descobre que Wendy é salva-vidas na piscina, assim decide que a melhor maneira de passar algum tempo com ela é se tornando um voluntário aí.\LIVRE - NÃO HÁ INADEQUAÇÕES\Estados Unidos\04
20200415\042924\045133\Os Vizinhos Green\Bill Funil / Crise no Bichobol\1\9\ \2018\Os Vizinhos Green é uma série animada de comédia e aventura que segue as aventuras pouco convencionais de Cricket Green, um garoto travesso e otimista de 10 anos que se muda à cidade grande com sua família. \ \LIVRE - NÃO HÁ INADEQUAÇÕES\Estados Unidos\04
20200415\045134\051404\Star vs. as Forças do Mal\É um Outro Mistério / Marco Jr.\3\52\ \2017\“Star vs. As Forças do Mal” acompanha Star, uma determinada princesa adolescente de outra dimensão. Após receber uma poderosa varinha mágica no seu aniversário de 14 anos, Star é enviada à Terra por seus pais para viver com a família Dias e seu responsável filho, Marco. Ela traz o seu estilo único e interdimensional ao novo lar. Ao lado de Marco, Star navega pelo colégio e embarca em aventuras por várias dimensões do multiverso, protegendo sua varinha das garras do seu arqui-inimigo, Ludo, e de suas monstruosas forças do mal.\ \LIVRE - NÃO HÁ INADEQUAÇÕES\Estados Unidos\04
20200415\051404\053643\Hotel Transylvania – A Série\Episódio 11\1\11\Genndy Tartakovsky\2017\Bem-vindo ao Hotel Transilvânia, o luxuoso resort cinco estacas do Drácula, onde monstros e suas famílias podem relaxar e onde humanos não entram. Um fim de semana especial, Drácula (Adam Sandler) convidou seus melhores amigos, Frankenstein e a esposa, a Múmia, o Homem Invisível, a família do Lobisomem e vários outros para comemorar o aniversário de 118 anos de sua querida filha Mavis (Selena Gomez). Receber todos esses monstros famosos é fácil para o Drácula, mas a festa realmente começa quando um cara comum chega ao hotel, e aí tudo pode mudar!\ \LIVRE - NÃO HÁ INADEQUAÇÕES\Estados Unidos\04
20200415\053643\060019\Acampados\Bastão do Espírito\1\5\Pamela Eells\2015\Emma, Ravi e Zuri Ross deixaram seu luxuoso apartamento em Nova York para ir curtir as férias de verão no rústico Acampamento Kikiwaka, no Maine, onde seus pais se conheceram quando eram adolescentes. Como CEE’s (Conselheiros em Trenamiento), precisam aprender os detalhes do ofício com a exageradamente alegre Lou e o galã do acampamento, Xander. Zuri faz amizade com dois jovens campistas, a exigente Tiffany e o mentiroso compulsivo Jorge. Gladys é a dona do acampamento e costuma ser ainda mais assustadora do que a lendária criatura que, segundo os rumores, circula pelas imediações do acampamento.  Com a ajuda de sua astuta sobrinha Hazel, Gladys não dá sossego às crianças Ross devido a uma grande rivalidade com a mãe delas. Junto com os novos amigos, Emma, Ravi e Zuri se adaptam ao novo “lar longe de casa” e sua emocionante realidade inédita no Acampamento Kikiwaka.\Emma e Xander perdem a rama espiritual do acampamento, o que maldisse aos campistas com má sorte. Enquanto isso, Jorge e Tiffany tentam ensinar a Ravi a nadar. \LIVRE - NÃO HÁ INADEQUAÇÕES\Estados Unidos\04
20200415\060020\062356\Gravity Falls: Um Verão de Mistérios\O Fim Profundo\1\13\Alex Hirsch \2012\Gravity Falls: Um Verão de Mistérios é uma série de animação cômica sobre os gêmeos Dipper e Mabel, dois garotos urbanos que vão passar as férias de verão com seu velho e rabugento tio-avô, Stan (mais conhecido como “Grunkle Stan”), que mora no povoado de Gravity Falls, no Oregon.\Quando Mabel faz amizade com um belo tritão que está preso no fundo da piscina pública, ela decide levá-lo de volta para sua família no oceano – mesmo que isso signifique que o seu romance relâmpago chegará ao fim. Enquanto isso, Dipper descobre que Wendy é salva-vidas na piscina, assim decide que a melhor maneira de passar algum tempo com ela é se tornando um voluntário aí.\LIVRE - NÃO HÁ INADEQUAÇÕES\Estados Unidos\04
20200415\062357\064720\Ducktales – Os Caçadores de Aventuras\ \2\41\ \2017\Baseado na clássica e amada série da Disney, "Ducktales" revive as aventuras do Pato Donald e seus três sobrinhos com o Tio Patinhas e vários outros personagens adoráveis.\ \LIVRE - NÃO HÁ INADEQUAÇÕES\Estados Unidos\04
20200415\064721\065921\Vá embora, Unicórnio!\ \1\14\ \2018\Vá embora, Unicórnio! As divertidas aventuras de uma esperta, forte, decidida e muito certinha menina chamada Alice e seu bagunceiro e apaixonante melhor amigo, Unicórnio.\ \LIVRE - NÃO HÁ INADEQUAÇÕES\Estados Unidos\04
20200415\065921\072457\Princesinha Sofia\A Princesa Presa no Quadro\2\41\Craig Gerber\2012\Princesinha Sofia é a primeira série centrada em uma princesa como uma garotinha. As histórias são projetadas para transmitir mensagens positivas e lições de vida que são aplicáveis a crianças em idade pré-escolar. As histórias da "Princesinha Sofia" se passam em um mundo de conto de fadas da jovem Sofia, que começa sua vida como uma garota normal. Mas quando sua mãe se casa com o rei, ela é levada para um glamouroso, mas às vezes confuso, mundo do castelo da realeza e seus novos meio-irmãos, Amber e James. "Princesinha Sofia" vai incluir participações da Fauna, Flora e Primavera (fadas vistas no clássico da Disney "A Bela Adormecida") como as diretoras da Royal Prep, a academia que a Sofia frequenta junto com outros príncipes e princesas. Aparições especiais serão feitas por personagens clássicos, como Cinderela e outras Princesas Disney.\Sofia e Hildegard ficam presas em uma pintura encantada e os planos de fuga se complicam quando Hildegard insiste em que ela sabe tudo. \LIVRE - NÃO HÁ INADEQUAÇÕES\Estados Unidos\04
20200415\072458\074920\Doutora Brinquedos\ \5\129\ \2018\ \ \LIVRE - NÃO HÁ INADEQUAÇÕES\Estados Unidos\04
20200415\074920\080059\Zip Zip\ \2\58\ \2016\A raposa Washington, o javali Sam, e Eugenie, a irmãzinha de Sam, estão cansados de sua vida monótona na natureza selvagem. Eles anseiam pela vida confortável dos lares elegantes da cidade e decidem se fazer passar por animais domésticos comuns. Até agora, ninguém percebeu nada, mas com certeza os instintos desses animaizinhos selvagens vão acabar se revelando nos momentos mais desafiadores, levando a muitas situações engraçadas e de suspense!\ \LIVRE - NÃO HÁ INADEQUAÇÕES\França\04
20200415\080100\081307\TOTS — Serviço de Entrega de Filhotes\Uma Entrega Pesada\1\2\Gilligan Chris\2019\O pinguim-pip e o flamingo Freddy são duas entregas de animais em T.O.T.S. Serviço de Transporte para Pequenos Juntos Ajudam a cuidar dos pequenos, enquanto viajam pelo mundo para encontrar um lar\ \LIVRE - NÃO HÁ INADEQUAÇÕES\Estados Unidos\04
20200415\081308\082614\Mickey Mouse — Mix de Aventuras\Um Dia de Unicórnio\3\117\Likomanov Broni\2019\Cachorro quente! O animado “Aventuras Mistas do Mickey Mouse” leva a estrela número 1 da Disney, Mickey Mouse, e seus amigos, Minnie, Pateta, Donald, Margarida, Plutão, Chip e Dale, em aventuras loucas por toda Hot Dog Hills em locais divertidos, incluindo Mickey's nova casa cheia de gadgets, o Mixed-Up Motor Lab da Mickey's Garage e o escritório Minnie, Daisy e Cuckoo Loca, Happy Helpers. Projetado para transmitir lições sobre amizade, trabalho em equipe e comunidade, cada episódio apresenta um intervalo de dança em que Mickey e sua turma convidam os espectadores a dançar junto com uma versão atualizada do cachorro-quente favorito dos fãs "Hot Dog!" música.\ \LIVRE - NÃO HÁ INADEQUAÇÕES\Estados Unidos\04
20200415\082615\085136\A Guarda do Leão\Babuínos Saltimbancos\2\36\Parkins Howy\2017\A Guarda do Leão começa quando Kion, o segundo filho de Simba e Nala, torna-se o líder da Guarda do Leão. O grupo reúne os mais ferozes, valentes, rápidos, fortes e de melhor visão para proteger as Terras do Reino. Em vez de formar um grupo de jovens leões para ajudá-lo, Kion desafia as tradições ao convocar os amigos que considera as melhores opções. Bunga, o mais valente, é um ratel destemido e fiel ao seu amigo Kion. Fuli é a mais veloz, uma confiante e atlética chita. Beshte, um alegre hipopótamo, é o mais forte. Ono, uma garça sábia, tem a visão mais aguçada do grupo. Ao longo do filme e da série, a equipe de jovens animais aprenderá a usar cada uma de suas habilidades para resolver problemas e proteger o Ciclo da Vida.\ \LIVRE - NÃO HÁ INADEQUAÇÕES\Estados Unidos\04
20200415\085136\090336\Hotel Transylvania: The Series\Doppelfanger\1\10\ \2017\Bem-vindo ao Hotel Transilvânia, o luxuoso resort cinco estacas do Drácula, onde monstros e suas famílias podem relaxar e onde humanos não entram. Um fim de semana especial, Drácula (Adam Sandler) convidou seus melhores amigos, Frankenstein e a esposa, a Múmia, o Homem Invisível, a família do Lobisomem e vários outros para comemorar o aniversário de 118 anos de sua querida filha Mavis (Selena Gomez). Receber todos esses monstros famosos é fácil para o Drácula, mas a festa realmente começa quando um cara comum chega ao hotel, e aí tudo pode mudar!\Mavis está muito empolgada com a visita da estrela do rock, Jett Black, ao Hotel Transylvania. Mas quando ela olha para um espelho amaldiçoado, um espelho para vampiros, ela acaba liberando seu reflexo zumbificado que sai pelo mundo causando estragos.\LIVRE - NÃO HÁ INADEQUAÇÕES\Estados Unidos\04
20200415\090336\091613\Nivis – Amigos de Outro Mundo\Brócolis do Espaço\1\2\Larre Emiliano\2019\Os Nivis chegam à vida de Felipe e sua família por acidente, e vão tentar descobrir como conviver sendo de mundos tão diferentes.\Felipe tem uma proposta de trabalho: fazer um livro ilustrado de uma família de brócolis do espaço, mas os Nivis, sem querer, dificultam a tarefa.\LIVRE - NÃO HÁ INADEQUAÇÕES\Argentina\04
20200415\091614\092826\Vá embora, Unicórnio!\ \1\2\ \2018\Vá embora, Unicórnio! As divertidas aventuras de uma esperta, forte, decidida e muito certinha menina chamada Alice e seu bagunceiro e apaixonante melhor amigo, Unicórnio.\ \LIVRE - NÃO HÁ INADEQUAÇÕES\Estados Unidos\04
20200415\092826\104851\Cinderela\ \ \ \Clyde Geronimi\1950\Cinderela, um dos grandes clássicos da Walt Disney Pictures, conta a história de uma bela jovem que, após a morte de seu pai, é obrigada a aturar sua malvada madrasta e suas meias-irmãs, como se fosse uma criada. A madrasta malvada proíbe Cinderela de ir ao Baile Real, mas a Fada Madrinha aparece e usa sua varinha mágica para transformar uma simples abóbora em uma carruagem mágica. Além disso, as roupas velhas da Cinderela se transformam em um belo vestido de gala. Cinderela fica, portanto, preparada para brilhar e só precisa encontrar o Príncipe para viver a história de amor mais cativante de todos os tempos.\ \LIVRE - NÃO HÁ INADEQUAÇÕES\Estados Unidos\04
20200415\104852\111137\Hotel Transylvania – A Série\Episódio 3\1\3\Genndy Tartakovsky\2017\Bem-vindo ao Hotel Transilvânia, o luxuoso resort cinco estacas do Drácula, onde monstros e suas famílias podem relaxar e onde humanos não entram. Um fim de semana especial, Drácula (Adam Sandler) convidou seus melhores amigos, Frankenstein e a esposa, a Múmia, o Homem Invisível, a família do Lobisomem e vários outros para comemorar o aniversário de 118 anos de sua querida filha Mavis (Selena Gomez). Receber todos esses monstros famosos é fácil para o Drácula, mas a festa realmente começa quando um cara comum chega ao hotel, e aí tudo pode mudar!\ \LIVRE - NÃO HÁ INADEQUAÇÕES\Estados Unidos\04
20200415\111137\113413\Star vs. as Forças do Mal\A Lua Se Lembra / O Traje de Banho\4\59\ \2019\Depois de receber a uma varinha mágica todo-poderosa em seu aniversário de 14 anos, Star é enviada à Terra para viver com a família Díaz e seu filho responsável, Marco. Junto com ele, navegam pelo colegial e embarcam em aventuras em diferentes dimensões, enquanto mantém sua varinha fora das garras de Ludo e suas monstruosas forças do mal. \ \LIVRE - NÃO HÁ INADEQUAÇÕES\Estados Unidos\04
20200415\113414\114628\Rua Dálmatas 101\ \1\3\ \2018\ \ \LIVRE - NÃO HÁ INADEQUAÇÕES\Reino Unido\04
20200415\114629\115814\Zip Zip\ \2\80\ \2016\A raposa Washington, o javali Sam, e Eugenie, a irmãzinha de Sam, estão cansados de sua vida monótona na natureza selvagem. Eles anseiam pela vida confortável dos lares elegantes da cidade e decidem se fazer passar por animais domésticos comuns. Até agora, ninguém percebeu nada, mas com certeza os instintos desses animaizinhos selvagens vão acabar se revelando nos momentos mais desafiadores, levando a muitas situações engraçadas e de suspense!\ \LIVRE - NÃO HÁ INADEQUAÇÕES\França\04
20200415\115814\120956\Cupcake & Dino - Serviços Gerais\ \1\6\ \2017\Cupcake e Dino são dois irmãos que encaram um empreendimento de serviços gerais. Eles aceitam qualquer trabalho, de cortar grama e cuidar de casas até deter um monstro de outra dimensão antes que devore a cidade inteira.\ \LIVRE - NÃO HÁ INADEQUAÇÕES\Brasil\01
20200415\120956\122142\Cupcake & Dino - Serviços Gerais\ \1\32\ \2019\Cupcake e Dino são dois irmãos que encaram um empreendimento de serviços gerais. Eles aceitam qualquer trabalho, de cortar grama e cuidar de casas até deter um monstro de outra dimensão antes que devore a cidade inteira.\ \LIVRE - NÃO HÁ INADEQUAÇÕES\Brasil\01
20200415\122142\124718\Glitter Model\ \2\19\ \2018\A Protagonista da série, Clara, é descoberta por um caça-talentos e aquela menina que sofria bullying na escola, com apelidos como “girafa desengonçada”, irá encontrar seu potencial e se transformará em uma linda modelo integrante de uma grande agência de modelos chamada “Glitter Model”. Glitter Model, por meio do fascinante mundo da moda, apresentará um estilo de vida saudável e abordará, de maneira séria, as responsabilidades que a carreira de modelo implica, demonstrando que como em qualquer outra profissão, serão necessários: empenho, disciplina, dedicação, profissionalismo e comprometimento, além da habilidade de lidar de forma positiva com as recusas que as modelos recebem diariamente quando não são aprovadas para trabalhos.\ \LIVRE - NÃO HÁ INADEQUAÇÕES\Brasil\01
20200415\124718\125923\Vá embora, Unicórnio!\ \1\17\ \2018\Vá embora, Unicórnio! As divertidas aventuras de uma esperta, forte, decidida e muito certinha menina chamada Alice e seu bagunceiro e apaixonante melhor amigo, Unicórnio.\ \LIVRE - NÃO HÁ INADEQUAÇÕES\Estados Unidos\04
20200415\125924\132932\Me Encontra em Paris\Time to Face the Music\1\14\ \2018\Lena Grisky é uma princesa russa de 1905 que estuda na escola de balé da Ópera de Paris. Acidentalmente, ela viaja no tempo e tem que se adaptar à vida do presente, tentando guardar seu segredo para lutar contra os Coletores do Tempo, que têm a intenção de capturá-la.
\ \LIVRE - NÃO HÁ INADEQUAÇÕES\ \04
20200415\132932\141005\Bia\ \2\82\Jorge Bechara\2019\ \Bia discute com seus pais, e é bem recebida na república Kunst. Manuel e Bia encontram um novo “companheiro de aventuras” no parque, e um erro de Manuel faz com que Bia se aproxime da verdade…
\LIVRE - NÃO HÁ INADEQUAÇÕES\Argentina\04
20200415\141005\142204\Hotel Transylvania: The Series\Stop or My Mummy Will Shout\1\24\ \2017\Bem-vindo ao Hotel Transilvânia, o luxuoso resort cinco estacas do Drácula, onde monstros e suas famílias podem relaxar e onde humanos não entram. Um fim de semana especial, Drácula (Adam Sandler) convidou seus melhores amigos, Frankenstein e a esposa, a Múmia, o Homem Invisível, a família do Lobisomem e vários outros para comemorar o aniversário de 118 anos de sua querida filha Mavis (Selena Gomez). Receber todos esses monstros famosos é fácil para o Drácula, mas a festa realmente começa quando um cara comum chega ao hotel, e aí tudo pode mudar!\ \LIVRE - NÃO HÁ INADEQUAÇÕES\Estados Unidos\04
20200415\142204\143349\Zip Zip\ \2\59\ \2016\A raposa Washington, o javali Sam, e Eugenie, a irmãzinha de Sam, estão cansados de sua vida monótona na natureza selvagem. Eles anseiam pela vida confortável dos lares elegantes da cidade e decidem se fazer passar por animais domésticos comuns. Até agora, ninguém percebeu nada, mas com certeza os instintos desses animaizinhos selvagens vão acabar se revelando nos momentos mais desafiadores, levando a muitas situações engraçadas e de suspense!\ \LIVRE - NÃO HÁ INADEQUAÇÕES\França\04
20200415\143349\145734\Coop and Cami ask the world\ \2\29\ \2019\Coop e Cami são dois irmãos de meia-idade que fazem crowdsource na tomada de decisões on-line. Eles apresentam duas opções para sua base de fãs, que eles chamam de Wratherheads, que escolhe quais coop, Coop, Cami, Fred ou Ollie devem fazer.\ \LIVRE - NÃO HÁ INADEQUAÇÕES\Estados Unidos\04
