20200501\060000\062459\Gravity Falls: Um Verão de Mistérios\Meia Ópera\2\25\Alex Hirsch \2013\Gravity Falls: Um Verão de Mistérios é uma série de animação cômica sobre os gêmeos Dipper e Mabel, dois garotos urbanos que vão passar as férias de verão com seu velho e rabugento tio-avô, Stan (mais conhecido como “Grunkle Stan”), que mora no povoado de Gravity Falls, no Oregon.\ \LIVRE - NÃO HÁ INADEQUAÇÕES\Estados Unidos\04
20200501\062459\064756\Ducktales – Os Caçadores de Aventuras\ \1\7\ \2017\Baseado na clássica e amada série da Disney, "Ducktales" revive as aventuras do Pato Donald e seus três sobrinhos com o Tio Patinhas e vários outros personagens adoráveis.\ \LIVRE - NÃO HÁ INADEQUAÇÕES\Estados Unidos\04
20200501\064756\070001\Vá embora, Unicórnio!\ \1\24\ \2018\Vá embora, Unicórnio! As divertidas aventuras de uma esperta, forte, decidida e muito certinha menina chamada Alice e seu bagunceiro e apaixonante melhor amigo, Unicórnio.\ \LIVRE - NÃO HÁ INADEQUAÇÕES\Estados Unidos\04
20200501\070002\072503\Princesinha Sofia\Carol, a Arqueira\2\54\Craig Gerber\2012\Princesinha Sofia é a primeira série centrada em uma princesa como uma garotinha. As histórias são projetadas para transmitir mensagens positivas e lições de vida que são aplicáveis a crianças em idade pré-escolar. As histórias da "Princesinha Sofia" se passam em um mundo de conto de fadas da jovem Sofia, que começa sua vida como uma garota normal. Mas quando sua mãe se casa com o rei, ela é levada para um glamouroso, mas às vezes confuso, mundo do castelo da realeza e seus novos meio-irmãos, Amber e James. "Princesinha Sofia" vai incluir participações da Fauna, Flora e Primavera (fadas vistas no clássico da Disney "A Bela Adormecida") como as diretoras da Royal Prep, a academia que a Sofia frequenta junto com outros príncipes e princesas. Aparições especiais serão feitas por personagens clássicos, como Cinderela e outras Princesas Disney.\ \LIVRE - NÃO HÁ INADEQUAÇÕES\Estados Unidos\04
20200501\072503\073811\Doutora Brinquedos e Seu Hospital\ \4\215\Norton  Virgien\2016\Doutora Brinquedos conta a história de uma garotinha de seis anos que tem a habilidade de falar com bichinhos de pelúcia e outros bonecos, dos quais cuida em sua clínica para brinquedos. Quando a pequena Doutora coloca o estetoscópio, acontece algo mágico: seus bonecos e bichinhos ganham vida e ela pode se comunicar com todos, até com os de seus amigos e de outras crianças da vizinhança. Os assistentes da Doutora na clínica especial são seus adoráveis bichinhos de pelúcia: Felpudo, um dragão muito orgulhoso; Lambie, sua meiga melhor amiga; Hallie, uma alegre e carinhosa enfermeira hipopótamo; Barulhento, um apavorado e escandaloso peixinho; e Gelinho, um boneco de neve que passa boa parte do tempo se consultando na clínica.\ \LIVRE - NÃO HÁ INADEQUAÇÕES\Estados Unidos\04
20200501\073811\075304\Vampirina\Vampiween\1\37\Jonmark Marten\2017\Vampirina conta a história de uma jovem vampire que enfrenta as alegrias e as provações de ser a nova garota na cidade quando sua família se muda da Transilvânia para a Pensilvânia.\ \LIVRE - NÃO HÁ INADEQUAÇÕES\Estados Unidos\04
20200501\075305\080522\TOTS — Serviço de Entrega de Filhotes\T.O.T.S. Tiny Ones Transport Service\1\13\Gilligan Chris\2019\O pinguim-pip e o flamingo Freddy são duas entregas de animais em T.O.T.S. Serviço de Transporte para Pequenos Juntos Ajudam a cuidar dos pequenos, enquanto viajam pelo mundo para encontrar um lar\ \LIVRE - NÃO HÁ INADEQUAÇÕES\Estados Unidos\04
20200501\080523\081827\Mickey Mouse — Mix de Aventuras\Um Dia de Unicórnio\3\117\Likomanov Broni\2019\Cachorro quente! O animado “Aventuras Mistas do Mickey Mouse” leva a estrela número 1 da Disney, Mickey Mouse, e seus amigos, Minnie, Pateta, Donald, Margarida, Plutão, Chip e Dale, em aventuras loucas por toda Hot Dog Hills em locais divertidos, incluindo Mickey's nova casa cheia de gadgets, o Mixed-Up Motor Lab da Mickey's Garage e o escritório Minnie, Daisy e Cuckoo Loca, Happy Helpers. Projetado para transmitir lições sobre amizade, trabalho em equipe e comunidade, cada episódio apresenta um intervalo de dança em que Mickey e sua turma convidam os espectadores a dançar junto com uma versão atualizada do cachorro-quente favorito dos fãs "Hot Dog!" música.\ \LIVRE - NÃO HÁ INADEQUAÇÕES\Estados Unidos\04
20200501\081828\084632\A Guarda do Leão\ \2\46\Parkins Howy\2017\A Guarda do Leão começa quando Kion, o segundo filho de Simba e Nala, torna-se o líder da Guarda do Leão. O grupo reúne os mais ferozes, valentes, rápidos, fortes e de melhor visão para proteger as Terras do Reino. Em vez de formar um grupo de jovens leões para ajudá-lo, Kion desafia as tradições ao convocar os amigos que considera as melhores opções. Bunga, o mais valente, é um ratel destemido e fiel ao seu amigo Kion. Fuli é a mais veloz, uma confiante e atlética chita. Beshte, um alegre hipopótamo, é o mais forte. Ono, uma garça sábia, tem a visão mais aguçada do grupo. Ao longo do filme e da série, a equipe de jovens animais aprenderá a usar cada uma de suas habilidades para resolver problemas e proteger o Ciclo da Vida.\ \LIVRE - NÃO HÁ INADEQUAÇÕES\Estados Unidos\04
20200501\084633\085853\Nivis – Amigos de Outro Mundo\Sonhando Acordada \1\12\Larre Emiliano\2019\Os Nivis chegam à vida de Felipe e sua família por acidente, e vão tentar descobrir como conviver sendo de mundos tão diferentes.\Um jogo entre Isabella e Blink faz com que Marisol, a vizinha, visite a casa de Amadeo e tope com os Nivis.\LIVRE - NÃO HÁ INADEQUAÇÕES\Argentina\04
20200501\085853\092153\Hotel Transylvania – A Série\Episódio 1\1\1\Genndy Tartakovsky\2017\Bem-vindo ao Hotel Transilvânia, o luxuoso resort cinco estacas do Drácula, onde monstros e suas famílias podem relaxar e onde humanos não entram. Um fim de semana especial, Drácula (Adam Sandler) convidou seus melhores amigos, Frankenstein e a esposa, a Múmia, o Homem Invisível, a família do Lobisomem e vários outros para comemorar o aniversário de 118 anos de sua querida filha Mavis (Selena Gomez). Receber todos esses monstros famosos é fácil para o Drácula, mas a festa realmente começa quando um cara comum chega ao hotel, e aí tudo pode mudar!\ \LIVRE - NÃO HÁ INADEQUAÇÕES\Estados Unidos\04
20200501\092153\093353\Vá embora, Unicórnio!\ \1\12\ \2018\Vá embora, Unicórnio! As divertidas aventuras de uma esperta, forte, decidida e muito certinha menina chamada Alice e seu bagunceiro e apaixonante melhor amigo, Unicórnio.\ \LIVRE - NÃO HÁ INADEQUAÇÕES\Estados Unidos\04
20200501\093354\094548\Zip Zip\ \2\55\ \2016\A raposa Washington, o javali Sam, e Eugenie, a irmãzinha de Sam, estão cansados de sua vida monótona na natureza selvagem. Eles anseiam pela vida confortável dos lares elegantes da cidade e decidem se fazer passar por animais domésticos comuns. Até agora, ninguém percebeu nada, mas com certeza os instintos desses animaizinhos selvagens vão acabar se revelando nos momentos mais desafiadores, levando a muitas situações engraçadas e de suspense!\ \LIVRE - NÃO HÁ INADEQUAÇÕES\França\04
20200501\094549\112737\Viva – A Vida É uma Festa\ \ \ \Lee Unkrich\2017\ Viva – A Vida é uma Festa conta a história de um menino de 12 anos chamado Miguel que desencadeia uma série de eventos relacionados com o mistério que leva a uma reunião familiar extraordinária. \ \LIVRE - VIOLÊNCIA\Estados Unidos\04
20200501\112738\114002\Rua Dálmatas 101\ \1\37\ \2018\ \ \LIVRE - NÃO HÁ INADEQUAÇÕES\Reino Unido\04
20200501\114002\120148\Zip Zip\ \2\92\ \2016\A raposa Washington, o javali Sam, e Eugenie, a irmãzinha de Sam, estão cansados de sua vida monótona na natureza selvagem. Eles anseiam pela vida confortável dos lares elegantes da cidade e decidem se fazer passar por animais domésticos comuns. Até agora, ninguém percebeu nada, mas com certeza os instintos desses animaizinhos selvagens vão acabar se revelando nos momentos mais desafiadores, levando a muitas situações engraçadas e de suspense!\ \LIVRE - NÃO HÁ INADEQUAÇÕES\França\04
20200501\120148\121334\Cupcake & Dino - Serviços Gerais\ \1\27\ \2019\Cupcake e Dino são dois irmãos que encaram um empreendimento de serviços gerais. Eles aceitam qualquer trabalho, de cortar grama e cuidar de casas até deter um monstro de outra dimensão antes que devore a cidade inteira.\ \LIVRE - NÃO HÁ INADEQUAÇÕES\Brasil\01
20200501\121334\122855\Cupcake & Dino - Serviços Gerais\ \1\28\ \2019\Cupcake e Dino são dois irmãos que encaram um empreendimento de serviços gerais. Eles aceitam qualquer trabalho, de cortar grama e cuidar de casas até deter um monstro de outra dimensão antes que devore a cidade inteira.\ \LIVRE - NÃO HÁ INADEQUAÇÕES\Brasil\01
20200501\122856\132744\SHOOK (TV SPECIAL)\ \ \ \ \2019\ \ \LIVRE - NÃO HÁ INADEQUAÇÕES\Estados Unidos\04
20200501\132745\140804\Bia\ \2\64\Jorge Bechara\2019\ \Ana ainda tem dificuldades em dar aulas de piano para Bia, que se prepara para o lançamento do disco. Os garotos resolvem o problema do vídeo que é posteado, sem saber que Marcos continua tentando sabotar o projeto. 
\LIVRE - NÃO HÁ INADEQUAÇÕES\Argentina\04
20200501\140804\142936\Star vs. as Forças do Mal\Star Precisa Se Animar / Star e Marco Vão às Compras\1\4\Daron Nefcy\2015\“Star vs. As Forças do Mal” acompanha Star, uma determinada princesa adolescente de outra dimensão. Após receber uma poderosa varinha mágica no seu aniversário de 14 anos, Star é enviada à Terra por seus pais para viver com a família Dias e seu responsável filho, Marco. Ela traz o seu estilo único e interdimensional ao novo lar. Ao lado de Marco, Star navega pelo colégio e embarca em aventuras por várias dimensões do multiverso, protegendo sua varinha das garras do seu arqui-inimigo, Ludo, e de suas monstruosas forças do mal.\Star se sente triste porque o garoto de quem ela gosta não liga pra ela, Oskar, assim que Marco tenta animá-la, mas por acidente reúne a Ludo e seu exército de novos monstros. / Star e Marco devem navegar por uma loja com forma de labirinto, Missão Compras, para obter um novo carregador para a varinha mágica antes de a de Star deixe de funcionar para sempre.\LIVRE - NÃO HÁ INADEQUAÇÕES\Estados Unidos\04
20200501\142936\145210\A Casa dos Vilões da Disney\ \ \ \ \2019\ \ \LIVRE - NÃO HÁ INADEQUAÇÕES\Estados Unidos\04
20200501\145210\162840\Alex & Co. – Como Crescer, apesar dos Pais\ \ \ \Luca Lucini\2016\O novo diretor do instituto decide eliminar a sala de aula de música do centro educacional. Dessa forma, ele quer impedir qualquer desejo artístico dos garotos e impedir que eles sejam submetidos ao concurso nacional de bandas.\ \LIVRE - NÃO HÁ INADEQUAÇÕES\Itália\04
20200501\162841\165630\Raven's Home\ \3\58\ \2019\ \ \LIVRE - NÃO HÁ INADEQUAÇÕES\Estados Unidos\04
20200501\165630\183553\Viva – A Vida É uma Festa\ \ \ \Lee Unkrich\2017\ Viva – A Vida é uma Festa conta a história de um menino de 12 anos chamado Miguel que desencadeia uma série de eventos relacionados com o mistério que leva a uma reunião familiar extraordinária. \ \LIVRE - VIOLÊNCIA\Estados Unidos\04
20200501\183554\190023\Gabby Duran – Babá de Aliens\ \1\10\ \2019\ \ \LIVRE - NÃO HÁ INADEQUAÇÕES\Estados Unidos\04
20200501\190024\194236\Bia\ \2\65\Jorge Bechara\2019\ \Finalmente os garotos conseguem postear o vídeo grupal de Beu, mas ninguém esperava a nova vingança de Marcos. Chega o dia do lançamento do disco da Moondust, mas o evento terá um final inesperado. 
\LIVRE - NÃO HÁ INADEQUAÇÕES\Argentina\04
20200501\194236\195501\Vá embora, Unicórnio!\ \1\25\ \2018\Vá embora, Unicórnio! As divertidas aventuras de uma esperta, forte, decidida e muito certinha menina chamada Alice e seu bagunceiro e apaixonante melhor amigo, Unicórnio.\ \LIVRE - NÃO HÁ INADEQUAÇÕES\Estados Unidos\04
20200501\195502\200435\Aqui no mar – Descendentes 2.5\ \ \ \ \2018\ \ \LIVRE - NÃO HÁ INADEQUAÇÕES\Estados Unidos\04
20200501\200436\203010\A Casa dos Vilões da Disney\ \ \ \ \2019\ \ \LIVRE - NÃO HÁ INADEQUAÇÕES\Estados Unidos\04
20200501\203010\221040\Camp Rock\ \ \ \Matthew Diamond\2008\O que Mitchie mais quer neste mundo é passar as férias de verão no prestigioso acampamento de rock, Camp Rock, para realizar seu sonho de se tornar uma cantora famosa. Ao chegar no acampamento, Mitchie descobre que entre os acampantes a competição é grande, principalmente no que diz respeito a chamar a atenção de SHANE GRAY - uma estrela pop adolescente e o professor mais popular deste verão. Shane - que busca inspiração para compôr - escuta Mitchie cantar sem conseguir ver seu rosto. Encantado por sua maravilhosa voz, procura a dona dessa linda sinfonia, enquanto ela confronta seus medos e aprende a ser uma estrela.\ \LIVRE - NÃO HÁ INADEQUAÇÕES\Estados Unidos\04
20200501\221041\225241\Bia\ \2\65\Jorge Bechara\2019\ \Finalmente os garotos conseguem postear o vídeo grupal de Beu, mas ninguém esperava a nova vingança de Marcos. Chega o dia do lançamento do disco da Moondust, mas o evento terá um final inesperado. 
\LIVRE - NÃO HÁ INADEQUAÇÕES\Argentina\04
20200501\225241\230440\Star vs. as Forças do Mal\Star vs. Echo Greek\2\33\ \2016\“Star vs. As Forças do Mal” acompanha Star, uma determinada princesa adolescente de outra dimensão. Após receber uma poderosa varinha mágica no seu aniversário de 14 anos, Star é enviada à Terra por seus pais para viver com a família Dias e seu responsável filho, Marco. Ela traz o seu estilo único e interdimensional ao novo lar. Ao lado de Marco, Star navega pelo colégio e embarca em aventuras por várias dimensões do multiverso, protegendo sua varinha das garras do seu arqui-inimigo, Ludo, e de suas monstruosas forças do mal.\ \LIVRE - NÃO HÁ INADEQUAÇÕES\Estados Unidos\04
20200501\230441\233048\Gravity Falls: Um Verão de Mistérios\Em Algum Lugar da Floresta\2\41\Alex Hirsch \2013\Gravity Falls: Um Verão de Mistérios é uma série de animação cômica sobre os gêmeos Dipper e Mabel, dois garotos urbanos que vão passar as férias de verão com seu velho e rabugento tio-avô, Stan (mais conhecido como “Grunkle Stan”), que mora no povoado de Gravity Falls, no Oregon.\ \LIVRE - NÃO HÁ INADEQUAÇÕES\Estados Unidos\04
20200501\233048\235316\Os Vizinhos Green\Bill Noturno / Cobra Barata\1\22\ \2018\Os Vizinhos Green é uma série animada de comédia e aventura que segue as aventuras pouco convencionais de Cricket Green, um garoto travesso e otimista de 10 anos que se muda à cidade grande com sua família. \ \LIVRE - NÃO HÁ INADEQUAÇÕES\Estados Unidos\04
20200501\235317\012946\Alex & Co. – Como Crescer, apesar dos Pais\ \ \ \Luca Lucini\2016\O novo diretor do instituto decide eliminar a sala de aula de música do centro educacional. Dessa forma, ele quer impedir qualquer desejo artístico dos garotos e impedir que eles sejam submetidos ao concurso nacional de bandas.\ \LIVRE - NÃO HÁ INADEQUAÇÕES\Itália\04
20200502\012947\014145\Star vs. as Forças do Mal\O Braço Monstro\01\5\Daron Nefcy\2015\“Star vs. As Forças do Mal” acompanha Star, uma determinada princesa adolescente de outra dimensão. Após receber uma poderosa varinha mágica no seu aniversário de 14 anos, Star é enviada à Terra por seus pais para viver com a família Dias e seu responsável filho, Marco. Ela traz o seu estilo único e interdimensional ao novo lar. Ao lado de Marco, Star navega pelo colégio e embarca em aventuras por várias dimensões do multiverso, protegendo sua varinha das garras do seu arqui-inimigo, Ludo, e de suas monstruosas forças do mal.\Quando Marco machuca o seu braço antes de um grande torneio de karatê, Star tenta curá-lo com magia. \LIVRE - NÃO HÁ INADEQUAÇÕES\Estados Unidos\04
20200502\014145\015257\Mickey Mouse\Mickey Mouse\1\4\ \2014\Mickey viaja a diferentes lugares para viver momentos fofos e heroicos com seus divertidos amigos: Minnie, Pato Donald, Margarida, Pateta e Pluto.\ \LIVRE - NÃO HÁ INADEQUAÇÕES\Estados Unidos\04
20200502\015257\024356\Sou Luna\Episódio 110\2\110\ \2017\ \ \LIVRE - NÃO HÁ INADEQUAÇÕES\Argentina\04
20200502\024357\030644\Hotel Transylvania – A Série\Episódio 9\1\9\Genndy Tartakovsky\2017\Bem-vindo ao Hotel Transilvânia, o luxuoso resort cinco estacas do Drácula, onde monstros e suas famílias podem relaxar e onde humanos não entram. Um fim de semana especial, Drácula (Adam Sandler) convidou seus melhores amigos, Frankenstein e a esposa, a Múmia, o Homem Invisível, a família do Lobisomem e vários outros para comemorar o aniversário de 118 anos de sua querida filha Mavis (Selena Gomez). Receber todos esses monstros famosos é fácil para o Drácula, mas a festa realmente começa quando um cara comum chega ao hotel, e aí tudo pode mudar!\ \LIVRE - NÃO HÁ INADEQUAÇÕES\Estados Unidos\04
20200502\030644\032936\A Irmã do Meio\Presa em um Roubo Misterioso\3\47\ \2017\Em A Irmã do Meio, a inventora, pesquisadora, mediadora e muito persuasiva Harley Díaz abre caminho através da loucura que é fazer parte de uma feliz família integrada por nove membros, a partir da vantajosa posição de ‘filha do meio’ pré-adolescente. A nova série de comédia, realizada com câmera única, tem como foco o público de 6 a 14 anos e suas famílias. As comoventes e divertidas histórias desta grande família mostram Harley idealizando formas criativas para enfrentar e se destacar em um lar localizado no subúrbio de Massachusetts. Sua criatividade frequentemente persuade os seus familiares, mesmo se tratando de personalidades muito diferentes convivendo sob o mesmo teto.\ \LIVRE - NÃO HÁ INADEQUAÇÕES\Estados Unidos\04
20200502\032936\035152\Jessie\Festa Aterrorizante do Chá\1\4\Pamela Eells\2011\Jessie es una chica pueblerina con grandes sueños que se embarca en la aventura más grande de su vida cuando decide dejar atrás sus noches estrelladas de la zona rural de Texas, y cambiarlas por las luces de la Gran Manzana. Entusiasmada ante la posibilidad de independizarse y resuelta a no dejarse intimidar por Nueva York, acepta un trabajo como niñera de una próspera pareja, Morgan y Pandora, y sus cuatro hijos: Emma, Ravi, Luke y Zuri.\Jessie convence a Luke de que ela pode ajuda-los a vencer a seu rival de paintball da vizinhança que ganha o jogo todos os anos. Enquanto isso, Zuri planeja uma festa de chá, e Emma é convidada e subitamente “desconvidada” à Semana da Moda por suas melhores amigas. \LIVRE - NÃO HÁ INADEQUAÇÕES\Estados Unidos\04
20200502\035153\041428\Star vs. as Forças do Mal\Vida Noturna / Mergulho Profundo\3\47\ \2017\“Star vs. As Forças do Mal” acompanha Star, uma determinada princesa adolescente de outra dimensão. Após receber uma poderosa varinha mágica no seu aniversário de 14 anos, Star é enviada à Terra por seus pais para viver com a família Dias e seu responsável filho, Marco. Ela traz o seu estilo único e interdimensional ao novo lar. Ao lado de Marco, Star navega pelo colégio e embarca em aventuras por várias dimensões do multiverso, protegendo sua varinha das garras do seu arqui-inimigo, Ludo, e de suas monstruosas forças do mal.\ \LIVRE - NÃO HÁ INADEQUAÇÕES\Estados Unidos\04
20200502\041428\043639\Gravity Falls: Um Verão de Mistérios\A Pequena Loja de Presentes dos Horrores\2\26\Alex Hirsch \2013\Gravity Falls: Um Verão de Mistérios é uma série de animação cômica sobre os gêmeos Dipper e Mabel, dois garotos urbanos que vão passar as férias de verão com seu velho e rabugento tio-avô, Stan (mais conhecido como “Grunkle Stan”), que mora no povoado de Gravity Falls, no Oregon.\ \LIVRE - NÃO HÁ INADEQUAÇÕES\Estados Unidos\04
20200502\043640\050239\Os Vizinhos Green\Bill Noturno / Cobra Barata\1\22\ \2018\Os Vizinhos Green é uma série animada de comédia e aventura que segue as aventuras pouco convencionais de Cricket Green, um garoto travesso e otimista de 10 anos que se muda à cidade grande com sua família. \ \LIVRE - NÃO HÁ INADEQUAÇÕES\Estados Unidos\04
20200502\050239\052443\Star vs. as Forças do Mal\Dia da Miunindependência / A Varinha Banágica\1\11\Daron Nefcy\2015\“Star vs. As Forças do Mal” acompanha Star, uma determinada princesa adolescente de outra dimensão. Após receber uma poderosa varinha mágica no seu aniversário de 14 anos, Star é enviada à Terra por seus pais para viver com a família Dias e seu responsável filho, Marco. Ela traz o seu estilo único e interdimensional ao novo lar. Ao lado de Marco, Star navega pelo colégio e embarca em aventuras por várias dimensões do multiverso, protegendo sua varinha das garras do seu arqui-inimigo, Ludo, e de suas monstruosas forças do mal.\Star encabeça a recriação de uma batalha como parte da celebração do Dia da Independência de Mewni com seus amigos na Terra. / Star vê um comercial de um produto mágico terrestre e parte por sua conta para comprá-lo, mas a missão quase fracassa quando por falta de conhecimento da Terra, Star se mete em graves problemas.\LIVRE - NÃO HÁ INADEQUAÇÕES\Estados Unidos\04
20200502\052443\060005\Hotel Transylvania – A Série\Episódio 24\1\24\Genndy Tartakovsky\2017\Bem-vindo ao Hotel Transilvânia, o luxuoso resort cinco estacas do Drácula, onde monstros e suas famílias podem relaxar e onde humanos não entram. Um fim de semana especial, Drácula (Adam Sandler) convidou seus melhores amigos, Frankenstein e a esposa, a Múmia, o Homem Invisível, a família do Lobisomem e vários outros para comemorar o aniversário de 118 anos de sua querida filha Mavis (Selena Gomez). Receber todos esses monstros famosos é fácil para o Drácula, mas a festa realmente começa quando um cara comum chega ao hotel, e aí tudo pode mudar!\ \LIVRE - NÃO HÁ INADEQUAÇÕES\Estados Unidos\04
20200502\060000\062603\Os 7A\A Pedra dos Sábios\1\24\Alfred Gimeno, Charles Visser\2014\Os 7A se passa no mundo de conto de fadas da Terra da alegria e conta a história de Feliz, Dengoso, Soneca, Atchim, Dunga, Zangado e Mestre, que precisam trabalhar juntos para manter a ordem do reino. Cruel e Hildy Gloom, um casal de bruxos, estão em seu caminho e planejam tirar a Lady Graça do trono para dominar a Terra da alegria. Situado na Floresta Encantada, o extravagante vilarejo da Terra da alegria é o lar dos Sete Anões e onde eles trabalham em sua mina de joias. Quando chamados pelo Sino Ding Dong, um sino mágico que vem do céu sempre que a Lady Graça precisa deles, os pequenos heróis correm para o lado da sua governante.\Numa busca épica para resgatar a Terra da Alegria, os 7A devem viajar para os cantos afastados do globo e recolher 7 pedras mágicas, que quando combinadas formam a Pedra dos Sábios, que é a fonte de toda magia.\LIVRE - NÃO HÁ INADEQUAÇÕES\Estados Unidos\04
20200502\062603\064906\As Enroladas Aventuras da Rapunzel\ \2\28\ \2018\Rapunzel suspende sua coroação para ir em busca de aventuras épicas, e seu pai, o rei, vai ter que aceitar que sua filha agora é uma jovem independente. Mas, quando seu cabelo volta a crescer repentinamente, ela tem que assumir suas qualidades mágicas, com tudo que isso significa.\ \LIVRE - NÃO HÁ INADEQUAÇÕES\Estados Unidos\04
20200502\064907\070117\Vá embora, Unicórnio!\ \1\34\ \2018\Vá embora, Unicórnio! As divertidas aventuras de uma esperta, forte, decidida e muito certinha menina chamada Alice e seu bagunceiro e apaixonante melhor amigo, Unicórnio.\ \LIVRE - NÃO HÁ INADEQUAÇÕES\Estados Unidos\04
20200502\070117\072638\Gravity Falls: Um Verão de Mistérios\A Batalha do Golf\2\22\Alex Hirsch \2013\Gravity Falls: Um Verão de Mistérios é uma série de animação cômica sobre os gêmeos Dipper e Mabel, dois garotos urbanos que vão passar as férias de verão com seu velho e rabugento tio-avô, Stan (mais conhecido como “Grunkle Stan”), que mora no povoado de Gravity Falls, no Oregon.\ \LIVRE - NÃO HÁ INADEQUAÇÕES\Estados Unidos\04
20200502\072638\074827\Toy Story de Terror\ \ \ \Angus MacLane\2013\Da Disney Pixar chega uma nova história apavorante, protagonizada pelos personagens favoritos dos filmes Toy Story! O que começa como uma divertida viagem para a turma de Toy Story, sofre uma inesperada reviravolta quando eles são desviados para um hotel na beira de uma estrada. Após o desaparecimento de um dos brinquedos, os outros se veem envolvidos em uma sequência de fatos misteriosos, que deverão ser desvendados antes que todos tenham o mesmo destino nesta história de terror.\ \LIVRE - NÃO HÁ INADEQUAÇÕES\Estados Unidos\04
20200502\074828\081153\Toy Story - Esquecidos pelo Tempo\ \ \ \Steve  Purcell\2014\Durante uma brincadeira, após o Natal, a turma de "Toy Story" vai parar em um território desconhecido. O grupo de brinquedos mais legal de todos acredita estar vivendo um terrível pesadelo! Agora a galera só quer retornar à segurança do quarto da Bonnie e depende de Trixie, a tricerátopo, para ajudá-la. Não percam esta emocionante aventura!\ \LIVRE - NÃO HÁ INADEQUAÇÕES\Estados Unidos\04
20200502\082320\084726\Star vs. as Forças do Mal\Frutinhas Blá Blá Blá / Descendo Rio abaixo\4\61\ \2019\Depois de receber a uma varinha mágica todo-poderosa em seu aniversário de 14 anos, Star é enviada à Terra para viver com a família Díaz e seu filho responsável, Marco. Junto com ele, navegam pelo colegial e embarcam em aventuras em diferentes dimensões, enquanto mantém sua varinha fora das garras de Ludo e suas monstruosas forças do mal. \ \LIVRE - NÃO HÁ INADEQUAÇÕES\Estados Unidos\04
